,name,brand,categories,marketName,depotName,price,unitPrice,updateDate,marketDistance,Şehir
Patlıcan,Patlıcan ,Markasız,"Normal Se, Meyve Ve Sebzeler, Patlıcan-kabak, Sebze, Normal Sebzeler",hakmar,Valide  Üsküdar,29.95,"29,95 ₺/kg",15.06.2025 14:54,0,İSTANBUL
Patlıcan,Patlıcan ,Markasız,"Normal Se, Meyve Ve Sebzeler, Patlıcan-kabak, Sebze, Normal Sebzeler",a101,Kadırga Fatih Istanbul,35.0,"35,00 ₺/kg",15.06.2025 14:54,0,İSTANBUL
Patlıcan,Patlıcan Kemer,Markasız,"Mevsi̇m Sebzeleri̇, Patlıcan, Sebzeler",sok,Mercan Mheminönü,34.9,"34,90 ₺/kg",15.06.2025 14:54,0,İSTANBUL
Patlıcan,Patlıcan Bostan,Markasız,"Meyvelerı Yenen Sebz, Normal Se, Mevsi̇m Sebzeleri̇, Meyve Ve Sebzeler, Patlıcan, Sebzeler, Taze Gıdalar, Sebze, Meyve Ve Sebze, Normal Sebzeler",sok,Cemberlıtas,49.9,"49,90 ₺/kg",15.06.2025 14:54,0,İSTANBUL
Patlıcan,Patlıcan Kemer Pazar,Markasız,"Meyvelerı Yenen Sebz, Taze Gıdalar, Sebze, Meyve Ve Sebze",carrefour,Istanbul Fatıh Mını,35.9,"35,90 ₺/kg",15.06.2025 14:54,0,İSTANBUL
Patlıcan,Kuru Patlıcan Dizi,Markasız,"Normal Se, Meyve Ve Sebzeler, Normal Sebzeler",hakmar,Selamlıüsküdar,89.5,"3,58 ₺/adet",15.06.2025 14:54,0,İSTANBUL
