,name,brand,categories,marketName,depotName,price,unitPrice,updateDate,marketDistance,Şehir
Salam,Namet Dilli Salam,Namet,"Sarküterı, Salamlar Kg, Taze Gıdalar, Et Ürünlerı",carrefour,Istanbul Cıhangır Gurme,1599.9,"1.599,90 ₺/kg",30.07.2025 08:55,0,İSTANBUL
Salam,Fümeci İtalyan Salam,Fümeci,"Sarküterı, Salamlar Kg, Taze Gıdalar, Et Ürünlerı",carrefour,Istanbul Cıhangır Gurme,2899.9,"2.899,90 ₺/kg",30.07.2025 08:55,0,İSTANBUL
Salam,Namet Mortedella Salam,Namet,"Sarküterı, Salamlar Kg, Taze Gıdalar, Et Ürünlerı",carrefour,Istanbul Cıhangır Gurme,1419.9,"1.419,90 ₺/kg",30.07.2025 08:55,0,İSTANBUL
Salam,Banvit Baton Salam 850g,Banvit,"Gıda, Self Servıs, Piliç, Et Şarküteri Paket, Paketli̇ Et Ürünleri̇, Et Şarküteri, Et-et Ürünleri-dondurulmuş Ürünler, Salam, İşlenmi̇ş Et Ürünleri̇, Et Ve Et Ürünleri, Paket Salam, Et şarküteri, Salam Piliç, Et Ve Etli̇ Mamüller",carrefour,Istanbul Fatıh Molla Güranı,75.1,"88,35 ₺/kg",30.07.2025 08:54,0,İSTANBUL
Salam,Banvit Baton Salam 850g,Banvit,"Gıda, Self Servıs, Piliç, Et Şarküteri Paket, Paketli̇ Et Ürünleri̇, Et Şarküteri, Et-et Ürünleri-dondurulmuş Ürünler, Salam, İşlenmi̇ş Et Ürünleri̇, Et Ve Et Ürünleri, Paket Salam, Et şarküteri, Salam Piliç, Et Ve Etli̇ Mamüller",tarim_kredi,Istanbul Beyoğlu Piyalepaşa,84.0,"98,82 ₺/kg",30.07.2025 08:54,0,İSTANBUL
Salam,Banvit Baton Salam 850g,Banvit,"Gıda, Self Servıs, Piliç, Et Şarküteri Paket, Paketli̇ Et Ürünleri̇, Et Şarküteri, Et-et Ürünleri-dondurulmuş Ürünler, Salam, İşlenmi̇ş Et Ürünleri̇, Et Ve Et Ürünleri, Paket Salam, Et şarküteri, Salam Piliç, Et Ve Etli̇ Mamüller",migros,Mjet Beyazıt Mithatpaşa,91.95,"108,18 ₺/kg",30.07.2025 08:54,0,İSTANBUL
Salam,Salam Piliç 1000 Gr,Markasız,"0104-salam, 01-etli Mamuller, 010403-salam Piliç",bim,Sinanağafatih,79.0,"79,00 ₺/kg",30.07.2025 08:55,0,İSTANBUL
Salam,Polonez Fıstıklı Salam 90 gr,Polonez,"Dana, Et Şarküteri, Gıda, Salam, Self Servıs, Paket Salam, Et Şarküteri Paket, Paketli̇ Et Ürünleri̇",carrefour,Istanbul Cıhangır Gurme,119.9,"1.332,22 ₺/kg",30.07.2025 08:54,0,İSTANBUL
Salam,Polonez Fıstıklı Salam 90 gr,Polonez,"Dana, Et Şarküteri, Gıda, Salam, Self Servıs, Paket Salam, Et Şarküteri Paket, Paketli̇ Et Ürünleri̇",migros,Mjet Yenikapı Aksaray Istanbul,129.9,"1.443,33 ₺/kg",30.07.2025 08:54,0,İSTANBUL
Salam,Keskinoğlu Piliç Salam 700 gr,Keskinoğlu,"Et Şarküteri, Paket Salam, Piliç, Et Şarküteri Paket",migros,Mjet Beyazıt Mithatpaşa,94.95,"135,64 ₺/kg",30.07.2025 08:54,0,İSTANBUL
Salam,Salam Piliç 250 gr Keskinoğlu,Keskinoğlu,"Salam, Salam Piliç, Et Ve Etli̇ Mamüller",a101,Atlamataşı Fatih Istanbul,35.25,"141,00 ₺/kg",30.07.2025 08:54,0,İSTANBUL
Salam,Polonez Macar Salam 90 gr,Polonez,"Dana, Et Şarküteri, Paket Salam, Et Şarküteri Paket",migros,Mjet Cağaloğlu Istanbul,129.9,"1.443,33 ₺/kg",30.07.2025 08:54,0,İSTANBUL
Salam,Fioruccı Napoli Salam 50 gr,Fiorucci,"Domuz Ürünleri Kg, Sarküterı, Et Şarküteri, Domuz, Taze Gıdalar, Et Ürünlerı, Paket Salam, Et Şarküteri Paket",carrefour,Istanbul Cıhangır Gurme,419.9,,30.07.2025 08:54,0,İSTANBUL
Salam,Carrefour Hindi Salam 50 gr,Carrefour,"Gıda, Salam, Self Servıs, Paketli̇ Et Ürünleri̇",carrefour,Istanbul Fatıh Mını,15.95,"319,00 ₺/kg",30.07.2025 08:54,0,İSTANBUL
Salam,Polonez Dana İtalyan Salam Biberli,Polonez,"Sarküterı, Salamlar Kg, Taze Gıdalar, Et Ürünlerı",carrefour,Istanbul Cıhangır Gurme,2029.9,"2.029,90 ₺/kg",30.07.2025 08:55,0,İSTANBUL
Salam,Salam Piliç Dilimli 150 gr,Markasız,"0104-salam, 01-etli Mamuller, 010403-salam Piliç",bim,Sinanağafatih,32.5,"216,67 ₺/kg",30.07.2025 08:55,0,İSTANBUL
Salam,Salam Piliç 900 Gr Tombik,Tombik,"0104-salam, 01-etli Mamuller, 010403-salam Piliç",bim,Sinanağafatih,89.0,"98,89 ₺/kg",30.07.2025 08:55,0,İSTANBUL
Salam,Aytaç Hindi Salam 500 gr,Aytaç,"Gıda, Salam, 0104-salam, Self Servıs, 01-etli Mamuller, 010402-salam Hindi, Paketli̇ Et Ürünleri̇",bim,Sinanağafatih,75.0,"150,00 ₺/kg",30.07.2025 08:55,0,İSTANBUL
Salam,Dana Macar Salam 2x50 Gr Namet,Markasız,"170123-salam Dana, 1701-etli̇ Mamuller, 17-grup Spot",bim,Sinanağafatih,42.5,"21,25 ₺/adet",30.07.2025 08:55,0,İSTANBUL
Salam,Açık Büfe Hindi Salam 900 Gr,Markasız,"1701-etli̇ Mamuller, 17-grup Spot, 170124-salam Hindi",bim,Sinanağafatih,99.0,"110,00 ₺/kg",30.07.2025 08:54,0,İSTANBUL
Salam,Salam Piliç Büfe 850 gr Keskinoğlu,Keskinoğlu,"Salam, Et şarküteri, Paket Salam, Piliç, Salam Piliç, Et Ve Etli̇ Mamüller, Et Şarküteri Paket",sok,Mercan Mheminönü,67.5,"79,41 ₺/kg",30.07.2025 08:54,0,İSTANBUL
Salam,Salam Piliç Büfe 850 gr Keskinoğlu,Keskinoğlu,"Salam, Et şarküteri, Paket Salam, Piliç, Salam Piliç, Et Ve Etli̇ Mamüller, Et Şarküteri Paket",a101,Atlamataşı Fatih Istanbul,85.5,"100,59 ₺/kg",30.07.2025 08:54,0,İSTANBUL
Salam,Açık Büfe Hindi Salam 50 Gr,Markasız,"1701-etli̇ Mamuller, 17-grup Spot, 170124-salam Hindi",bim,Sinanağafatih,10.0,"200,00 ₺/kg",30.07.2025 08:54,0,İSTANBUL
Salam,Salam Hindi Füme 110 gr Namet,Namet,"Salam, Salam Hindi, Et Ve Etli̇ Mamüller",a101,Atlamataşı Fatih Istanbul,45.25,"411,36 ₺/kg",30.07.2025 08:54,0,İSTANBUL
Salam,Salam Piliç Büfe 1000 gr Aspiliç,Aspiliç,"Salam, Salam Piliç, Et Ve Etli̇ Mamüller",a101,Atlamataşı Fatih Istanbul,69.0,"69,00 ₺/kg",30.07.2025 08:54,0,İSTANBUL
Salam,Pınar Keyifle Hindi Salam 500 gr,Pınar,"Et şarküteri, Paket Salam, Hindi, Et Şarküteri Paket",sok,Mercan Mheminönü,75.0,"150,00 ₺/kg",30.07.2025 08:54,0,İSTANBUL
Salam,Polonez Hindi Fıstıklı Salam 90 gr,Polonez,"Et Şarküteri, Gıda, Salam, Self Servıs, Paket Salam, Hindi, Et Şarküteri Paket, Paketli̇ Et Ürünleri̇",carrefour,Istanbul Cıhangır Gurme,57.9,"643,33 ₺/kg",30.07.2025 08:54,0,İSTANBUL
Salam,Maret Pratik Macar Salam 50 gr,Maret,"Gıda, Salam, Self Servıs, Paketli̇ Et Ürünleri̇",carrefour,Istanbul Cıhangır Gurme,75.9,"1.518,00 ₺/kg",30.07.2025 08:54,0,İSTANBUL
Salam,Polonez Dana Macar Salam 50 gr,Polonez,"Dana, Gıda, Et Şarküteri, Salam, Self Servıs, Paket Salam, Paketli̇ Et Ürünleri̇, Et Şarküteri Paket",carrefour,Istanbul Fatıh Mını,73.9,"1.478,00 ₺/kg",30.07.2025 08:54,0,İSTANBUL
