Ürün Adı,Fiyat
 Slim Fit Italyan Kesim Kaşe Kaban Djplusstyle 1114,669.99
 Slim Fit Kalın Kürklü Parka Kaban,1768.99
Dar Kesim Dik Yaka Uzun Kaşe Kaban 330,1549.0
ERKEK UZUN KAŞE PALTO,1699.0
Erkek Dar Kesim Uzun Kaşe Kaban,1749.0
Erkek Dar Kesim Uzun Yünlü Kaşe Palto,1799.0
Erkek Füme Slim Fit Dik Yaka Kaşe Kaban,957.44
Erkek Kaban Kaşe Slım Fit Dar Kesim Yeni Sezon,999.0
Erkek Kapşonlu Uzun Kaşe Kaban,1599.0
"Erkek Kışlık Oversize Kısa Kaşe Kaban Ceket - Düğmeli, Şık Ve Sıcak Tasarım",1118.0
Erkek Rahat Kesim Rüzgar Geçirmez Siyah Kaşmir Kaşe Kaban,1438.66
Erkek Siyah Slim Fit Dik Yaka Kaşe Kaban,1093.01
Erkek Siyah Slim Fit Kemerli Kaşe Kaban,1188.26
Erkek Siyah Uzun Regular Fit Kaşe Kaban,1732.37
Erkek Yün Karışımlı Kaşe Kapşonlu Önü Fermuarlı Ve Düğmeli Uzun Kaban,1799.0
Ezel Dik Yaka Güğüste Düğme Kase Kaban,1549.0
Hakim Yaka Regular Kalıp Armürlü Kaban,1499.0
Klasik Gömlek Yaka Diz Üstü Kaşe Kaban,1649.0
OVERSIZE KESİM KABAN SİYAH,2549.9
Slim Fit Düğmeli Dik Yaka Kaşe Kaban 19/12,1549.0
Slim Fit Spor Ezel Kaşe Kaban,1549.0
Süvari Bol Kesim Hakim Yaka Dokulu Bej Erkek Kaban,2499.99
Süvari Dar Kesim Yeşil Kruvaze Yumuşak Dokulu Erkek Kaban,2099.9
Yeni Sezon Oversize Rahat Kesim Uzun Erkek Kaşe Kaban Palto,1008.23
