,name,brand,categories,marketName,depotName,price,unitPrice,updateDate,marketDistance,Şehir
Balık,İstavrit Orta kg ( m ),Markasız,"Su Ürünleri Dökme Tedarikçi, Deniz Mevsim Balıkları, Deni̇z Mevsi̇m Balıkları, Balık Ve Su Ürünleri",migros,5m Aydın Kipa Avm,299.9,"299,90 ₺/kg",02.08.2025 11:48,0,AYDIN
Balık,Çipura 300 - 400,Markasız,"Balıklar, Taze Gıdalar, Balık, Kültür Balıkları",carrefour,Istanbul Cıhangır Gurme,399.0,"399,00 ₺/kg",02.08.2025 11:49,0,İSTANBUL
Balık,Levrek 400 - 600,Markasız,"Balıklar, Taze Gıdalar, Balık, Kültür Balıkları",carrefour,Istanbul Cıhangır Gurme,549.0,"549,00 ₺/kg",02.08.2025 11:48,0,İSTANBUL
Balık,Çıtır Levrek Burger 400 gr,Markasız,"İşlenmi̇ş Ürünler, Taze Gıdalar, Balık, Dondurulmuş Ürünler",carrefour,Istanbul Cıhangır Gurme,409.0,"1.022,50 ₺/kg",02.08.2025 11:48,0,İSTANBUL
Balık,Marex Simit Levrek 400 gr,Markasız,"İşlenmi̇ş Ürünler, Taze Gıdalar, Balık, Dondurulmuş Ürünler",carrefour,Istanbul Cıhangır Gurme,329.0,"822,50 ₺/kg",02.08.2025 11:48,0,İSTANBUL
Balık,Kaya Levreği,Markasız,"Balıklar, Av Balıkları, Taze Gıdalar, Balık",carrefour,Istanbul Cıhangır Gurme,279.0,"279,00 ₺/kg",02.08.2025 11:49,0,İSTANBUL
