,name,brand,categories,marketName,depotName,price,unitPrice,updateDate,marketDistance,Şehir
Kabak,Kabak,Markasız,"Patlıcan-kabak, Meyve Ve Sebzeler, Sebze",a101,Atlamataşı Fatih Istanbul,32.9,"32,90 ₺/kg",02.08.2025 11:48,0,İSTANBUL
Kabak,Bal Kabak,Markasız,"Sebzeler, Mevsi̇m Sebzeleri̇ İşleti̇ci̇, Kabak Kg.işletici, Sebzeler Işletici",sok,Cemberlıtas,49.9,"49,90 ₺/kg",02.08.2025 11:48,0,İSTANBUL
Kabak,Kabak Sakız,Markasız,"Meyvelerı Yenen Sebz, Mevsi̇m Sebzeleri̇, Sebzeler, Taze Gıdalar, Kabak, Sebze, Meyve Ve Sebze",carrefour,Istanbul Fatıh Mını,26.9,"26,90 ₺/kg",02.08.2025 11:48,0,İSTANBUL
Kabak,Kabak Sakız,Markasız,"Meyvelerı Yenen Sebz, Mevsi̇m Sebzeleri̇, Sebzeler, Taze Gıdalar, Kabak, Sebze, Meyve Ve Sebze",sok,Cemberlıtas,39.9,"39,90 ₺/kg",02.08.2025 11:48,0,İSTANBUL
Kabak,Kabak Dolmalık Top,Markasız,"Meyvelerı Yenen Sebz, Taze Gıdalar, Sebze, Meyve Ve Sebze",carrefour,Istanbul Fatıh Mını,99.95,"99,95 ₺/kg",02.08.2025 11:49,0,İSTANBUL
