,name,brand,categories,marketName,depotName,price,unitPrice,updateDate,marketDistance,Şehir
Nohut,Migros Nohut 1 kg,Migros,"Pl Bakliyat Bulgur Pirinç, Pl Bakliyat Bulgur Pirinç Şeker, Pl Bakli̇yat, Pl Nohut",migros,Mjet Cağaloğlu Istanbul,54.95,"54,95 ₺/kg",06.06.2025 10:18,0,İSTANBUL
Nohut,Nohut 2.5 kg Saban,Saban,"1704-bakli̇yat Ve Unlu Mamuller, 170412-nohut, 17-grup Spot",bim,Sinanağafatih,125.0,"50,00 ₺/kg",06.06.2025 10:18,0,İSTANBUL
Nohut,Nohut 1000 gr Bizebi,Bizebi,"1704-bakli̇yat Ve Unlu Mamuller, 170412-nohut, 17-grup Spot",bim,Sinanağafatih,29.75,"29.750,00 ₺/kg",06.06.2025 10:18,0,İSTANBUL
Nohut,Carrefour Nohut 1 kg,Carrefour,"Kuru Gıdalar, Gıda, Çorba Ve Bakli̇yatlar, Kuru Baklıyatlar",carrefour,Istanbul Fatıh Mını,54.5,"54,50 ₺/kg",06.06.2025 10:18,0,İSTANBUL
Nohut,Nohut 1 kg Rençber,Rençber,"Konserveler Ve Çorbalar, Koçbaşı N, Koçbaşı Nohut",hakmar,Valide  Üsküdar,54.5,"54,50 ₺/kg",06.06.2025 10:18,0,İSTANBUL
Nohut,Nohut 1000 Gr Saban,Saban,"040205-nohut, 04-bakliyat Ve Unlu Mamuller, 0402-bakli̇yat",bim,Sinanağafatih,54.5,"54,50 ₺/kg",06.06.2025 10:18,0,İSTANBUL
Nohut,Anadolu Mutfağı Nohut 1000 gr,Anadolu Mutfağı,"Bakliyat-bulgur-pirinç, Kuru Fasülye, Bakli̇yat",sok,Mercan Mheminönü,49.0,"49,00 ₺/kg",06.06.2025 10:18,0,İSTANBUL
Nohut,Ots Organik Nohut 750 gr,OTS,"Organik Bakliyat, Bakliyat Bulgur Pirinç Şeker, Kuru Gıdalar, Gıda, Bakliyat, Organi̇k Ve Özel Beslenme, Sağlıklı Yaşam Ürünleri, Ekoloji̇k Bi̇yoloji̇k Ürün",carrefour,Istanbul Cıhangır Gurme,300.5,"400,67 ₺/kg",06.06.2025 10:18,0,İSTANBUL
Nohut,Carrefour Beyaz Nohut 1 kg,Carrefour,"Kuru Gıdalar, Gıda, Çorba Ve Bakli̇yatlar, Kuru Baklıyatlar",carrefour,Istanbul Fatıh Mını,87.5,"87,50 ₺/kg",06.06.2025 10:18,0,İSTANBUL
Nohut,Nohut Beyaz 1 kg Rençber,Rençber,"Un Ve Bakliyatlar, Beyaz Nohut, Beyaz Noh",hakmar,Valide  Üsküdar,89.75,"89,75 ₺/kg",06.06.2025 10:18,0,İSTANBUL
Nohut,Nohut Beyaz 1000 gr Saban,Saban,"040205-nohut, 04-bakliyat Ve Unlu Mamuller, 0402-bakli̇yat",bim,Sinanağafatih,87.5,"87,50 ₺/kg",06.06.2025 10:18,0,İSTANBUL
Nohut,Hasata Beyaz Nohut 1 kg,Hasata,"Kuru Gıdalar, Gıda, Çorba Ve Bakli̇yatlar, Kuru Baklıyatlar",carrefour,Istanbul Cıhangır Gurme,192.5,"192,50 ₺/kg",06.06.2025 10:18,0,İSTANBUL
Nohut,Yerli Nohut 9mm 1000 gr Saban,Saban,"040205-nohut, 04-bakliyat Ve Unlu Mamuller, 0402-bakli̇yat",bim,Sinanağafatih,65.0,"65.000,00 ₺/kg",06.06.2025 10:17,0,İSTANBUL
Nohut,Carrefour Bio Organik nohut 1 kg,Carrefour,"Organik Bakliyat, Kuru Gıdalar, Gıda, Organi̇k Ve Özel Beslenme",carrefour,Istanbul Fatıh Mını,105.95,"105,95 ₺/kg",06.06.2025 10:17,0,İSTANBUL
Nohut,Reis Royal Beyaz Nohut 500 gr,Reis,"Bakliyat Bulgur Pirinç Şeker, Kuru Gıdalar, Gıda, Bakliyat Bulgur Pirinç, Bakli̇yat, Çorba Ve Bakli̇yatlar, Nohut, Kuru Baklıyatlar",carrefour,Istanbul Fatıh Mını,89.2,"178,40 ₺/kg",06.06.2025 10:18,0,İSTANBUL
Nohut,Hasata Kırşehir Koçbaşı Nohut 1 kg,Hasata,"Bakliyat Bulgur Pirinç Şeker, Kuru Gıdalar, Gıda, Bakliyat Bulgur Pirinç, Bakliyat, Bakli̇yat, Nohut, Çorba Ve Bakli̇yatlar, Kuru Baklıyatlar, Bakli̇yat Ve Kuru Gıdalar",carrefour,Istanbul Cıhangır Gurme,129.9,"129,90 ₺/kg",06.06.2025 10:17,0,İSTANBUL
Nohut,Tarım Kredi Anadolu Nohut 1 Kg,Tarım Kredi,"Gıda, Temel Gıda Ürünleri, Bakli̇yat, Nohut",tarim_kredi,Istanbul Beyoğlu Piyalepaşa,54.0,"54,00 ₺/kg",06.06.2025 10:18,0,İSTANBUL
Nohut,Tarım Kredi Nohut 8.5 Mm 1 kg,Tarım Kredi,"Gıda, Temel Gıda Ürünleri, Bakli̇yat, Nohut",tarim_kredi,Istanbul Beyoğlu Piyalepaşa,69.9,"69,90 ₺/kg",06.06.2025 10:18,0,İSTANBUL
Nohut,Duru Koçbaşı Nohut 8 M 1 kg,Duru,"Kuru Gıdalar, Gıda, Çorba Ve Bakli̇yatlar, Kuru Baklıyatlar",carrefour,Istanbul Karaköy Mını,58.45,"58,45 ₺/kg",06.06.2025 10:18,0,İSTANBUL
Nohut,Tat Organik Haşlanmış Nohut 710 Gr Cam Ta,Tat,"Organik Bakliyat, Kuru Gıdalar, Gıda, Organi̇k Ve Özel Beslenme",carrefour,Istanbul Cıhangır Gurme,59.9,"84,37 ₺/kg",06.06.2025 10:18,0,İSTANBUL
Nohut,M life Bio Organik Nohut 1 kg (pl1),Mlıfe,"Pl Bakliyat, Pl Bakliyat Bulgur Pirinç Şeker, Pl Sağlıklı Yaşam Ürünleri, Pl Ekoloji̇k Bi̇yoloji̇k Ürün",migros,Mjet Kumkapı Istanbul,105.95,"105,95 ₺/kg",06.06.2025 10:18,0,İSTANBUL
Nohut,R.k Tat Nohut 8 Mr. Muscle 1 kg Ürünü,Tat,"Kuru Gıdalar, Gıda, Çorba Ve Bakli̇yatlar, Kuru Baklıyatlar",carrefour,Istanbul Fatıh Mını,92.95,"92,95 ₺/kg",06.06.2025 10:18,0,İSTANBUL
