,name,brand,categories,marketName,depotName,price,unitPrice,updateDate,marketDistance,Şehir
Baklava,Dondurulmuş Soğuk Baklava 400 gr Sinangil,Sinangil,"Donuk Pasta-tatlı, Et-et Ürünleri-dondurulmuş Ürünler, Et Ve Et Ürünleri, Dondurma Ve Dondurulmuş Ürünler, 110702-dond. Tatlılar, Dondurulmuş Ürünler, Dondurulmuş, 1107-dondurulmuş Pasta & Tatlılar, Tatlılar, 11-dondurulmuş Ürünler",tarim_kredi,Istanbul Fatih Market,174.9,"437,25 ₺/kg",10.07.2025 10:19,0,İSTANBUL
Baklava,Dondurulmuş Soğuk Baklava 400 gr Sinangil,Sinangil,"Donuk Pasta-tatlı, Et-et Ürünleri-dondurulmuş Ürünler, Et Ve Et Ürünleri, Dondurma Ve Dondurulmuş Ürünler, 110702-dond. Tatlılar, Dondurulmuş Ürünler, Dondurulmuş, 1107-dondurulmuş Pasta & Tatlılar, Tatlılar, 11-dondurulmuş Ürünler",bim,Sinanağafatih,175.0,"437,50 ₺/kg",10.07.2025 10:19,0,İSTANBUL
Baklava,Dondurulmuş Soğuk Baklava 400 gr Sinangil,Sinangil,"Donuk Pasta-tatlı, Et-et Ürünleri-dondurulmuş Ürünler, Et Ve Et Ürünleri, Dondurma Ve Dondurulmuş Ürünler, 110702-dond. Tatlılar, Dondurulmuş Ürünler, Dondurulmuş, 1107-dondurulmuş Pasta & Tatlılar, Tatlılar, 11-dondurulmuş Ürünler",a101,Atlamataşı Fatih Istanbul,175.0,"437,50 ₺/kg",10.07.2025 10:19,0,İSTANBUL
Baklava,Dondurulmuş Dubai Baklava 220 gr Çıtırtat,Çıtırtat,"Dondurma Ve Dondurulmuş Ürünler, Dondurulmuş Ürünler, Tatlılar",a101,Kadırga Fatih Istanbul,139.0,"631,82 ₺/kg",10.07.2025 10:20,0,İSTANBUL
Baklava,Yeşil Çikolatalı Cevizli Soğuk Baklava 900 gr,Taneli,"Donuk Dondurma, Pasta Tatlı, Dondurulmuş Gıda",migros,Mjet Cağaloğlu Istanbul,299.95,"333,28 ₺/kg",10.07.2025 10:20,0,İSTANBUL
