,name,brand,categories,marketName,depotName,price,unitPrice,updateDate,marketDistance,Şehir
Kuzu Eti,Kuzu Pirzola,Tarım Kredi,"Kuzu Eti Ürünleri, Et-et Ürünleri-dondurulmuş Ürünler, Kozmetik Ve Kişisel Bakım, Et Ve Et Ürünleri, Kırmızı Et, Kuzu Eti",hakmar,Valide  Üsküdar,1400.0,"1.400,00 ₺/kg",21.07.2025 10:20,0,İSTANBUL
Kuzu Eti,Kuzu Kaburga ,Tarım Kredi,"Kuzu Eti Ürünleri, Et-et Ürünleri-dondurulmuş Ürünler, Et Ve Et Ürünleri, Kırmızı Et, Kuzu Eti, Spot Ürünler",hakmar,Valide  Üsküdar,595.0,"595,00 ₺/kg",21.07.2025 10:20,0,İSTANBUL
Kuzu Eti,Kuzu Kuşbaşı,Tarım Kredi,"Kuzu Eti Ürünleri, Et-et Ürünleri-dondurulmuş Ürünler, Et Ve Et Ürünleri, Bisküvi,şekerleme,mamalar Ve Sağlık Ürün, Kırmızı Et, Kuzu Eti",hakmar,Valide  Üsküdar,645.0,"645,00 ₺/kg",21.07.2025 10:20,0,İSTANBUL
Kuzu Eti,Kuzu Sac Kavurma ,Esk,"Kuzu Eti Ürünleri, Kuzu Eti, Spot Ürünler",hakmar,Valide  Üsküdar,595.0,"595,00 ₺/kg",21.07.2025 10:20,0,İSTANBUL
Kuzu Eti,Kuzu Incik Haşlama ,Haket,"Kuzu Eti Ürünleri, Tl Yükleme, Kuzu Eti",hakmar,Valide  Üsküdar,395.0,"395,00 ₺/kg",21.07.2025 10:20,0,İSTANBUL
Kuzu Eti,Kuzu-dana Kıyma Yağlı 500 gr,Haket,"Meyve Ve Sebzeler, Kuzu Eti Ürünleri, Kuzu Eti",hakmar,Selami Çeşme  Kadıköy,290.0,"580,00 ₺/kg",21.07.2025 10:20,0,İSTANBUL
