,name,brand,categories,marketName,depotName,price,unitPrice,updateDate,marketDistance,Şehir
Kabak,Kabak ,Markasız,"Normal Se, Meyve Ve Sebzeler, Patlıcan-kabak, Sebze, Normal Sebzeler",a101,Kadırga Fatih Istanbul,42.9,"42,90 ₺/kg",23.07.2025 10:19,0,İSTANBUL
Kabak,Bal Kabak,Markasız,"Sebzeler, Mevsi̇m Sebzeleri̇ İşleti̇ci̇, Kabak Kg.işletici, Sebzeler Işletici",sok,Cemberlıtas,49.9,"49,90 ₺/kg",23.07.2025 10:19,0,İSTANBUL
Kabak,Kabak Sakız,Markasız,"Meyvelerı Yenen Sebz, Mevsi̇m Sebzeleri̇, Sebzeler, Taze Gıdalar, Kabak, Sebze, Meyve Ve Sebze",carrefour,Istanbul Fatıh Mını,19.9,"19,90 ₺/kg",23.07.2025 10:19,0,İSTANBUL
Kabak,Kabak Sakız,Markasız,"Meyvelerı Yenen Sebz, Mevsi̇m Sebzeleri̇, Sebzeler, Taze Gıdalar, Kabak, Sebze, Meyve Ve Sebze",sok,Cemberlıtas,39.9,"39,90 ₺/kg",23.07.2025 10:19,0,İSTANBUL
Kabak,Kabak Siyah,Markasız,"Meyvelerı Yenen Sebz, Taze Gıdalar, Sebze, Meyve Ve Sebze",carrefour,Istanbul Cıhangır Gurme,46.95,"46,95 ₺/kg",23.07.2025 10:19,0,İSTANBUL
Kabak,Kabak Dolmalık Top,Markasız,"Meyvelerı Yenen Sebz, Taze Gıdalar, Sebze, Meyve Ve Sebze",carrefour,Istanbul Fatıh Mını,94.95,"94,95 ₺/kg",23.07.2025 10:19,0,İSTANBUL
