,name,brand,categories,marketName,depotName,price,unitPrice,updateDate,marketDistance,Şehir
Patlıcan,Patlıcan,Markasız,"Normal Se, Meyve Ve Sebzeler, Patlıcan-kabak, Patlıcan, Meyve Sebze, Meyve-sebze, Sebze, Normal Sebzeler",hakmar,Valide  Üsküdar,34.95,"34,95 ₺/kg",29.06.2025 10:20,0,İSTANBUL
Patlıcan,Patlıcan,Markasız,"Normal Se, Meyve Ve Sebzeler, Patlıcan-kabak, Patlıcan, Meyve Sebze, Meyve-sebze, Sebze, Normal Sebzeler",a101,Kadırga Fatih Istanbul,35.0,"35,00 ₺/kg",29.06.2025 10:20,0,İSTANBUL
Patlıcan,Patlıcan,Markasız,"Normal Se, Meyve Ve Sebzeler, Patlıcan-kabak, Patlıcan, Meyve Sebze, Meyve-sebze, Sebze, Normal Sebzeler",tarim_kredi,Istanbul Beyoğlu Piyalepaşa,39.9,"39,90 ₺/kg",29.06.2025 10:20,0,İSTANBUL
Patlıcan,Patlıcan Kemer,Markasız,"Mevsi̇m Sebzeleri̇, Patlıcan, Sebzeler",sok,Mercan Mheminönü,34.9,"34,90 ₺/kg",29.06.2025 10:20,0,İSTANBUL
Patlıcan,Patlıcan Bostan,Markasız,"Meyvelerı Yenen Sebz, Normal Se, Mevsi̇m Sebzeleri̇, Meyve Ve Sebzeler, Patlıcan, Sebzeler, Taze Gıdalar, Sebze, Meyve Ve Sebze, Normal Sebzeler",sok,Cemberlıtas,44.9,"44,90 ₺/kg",29.06.2025 10:20,0,İSTANBUL
Patlıcan,Patlıcan Kemer Pazar,Markasız,"Meyvelerı Yenen Sebz, Taze Gıdalar, Sebze, Meyve Ve Sebze",carrefour,Istanbul Fatıh Mını,45.9,"45,90 ₺/kg",29.06.2025 10:20,0,İSTANBUL
Patlıcan,Kuru Patlıcan Dizi,Markasız,"Normal Se, Meyve Ve Sebzeler, Normal Sebzeler",hakmar,Selamlıüsküdar,89.5,"3,58 ₺/adet",29.06.2025 10:20,0,İSTANBUL
