,name,brand,categories,marketName,depotName,price,unitPrice,updateDate,marketDistance,Şehir
Mantar,Mantar Istiridye ,Markasız,"Meyve Ve Sebzeler, Mantar, Sebze",a101,Kadırga Fatih Istanbul,59.5,"238,00 ₺/kg",03.07.2025 10:20,0,İSTANBUL
Mantar,Mantar Tabak ,Markasız,"Meyve Ve Sebzeler, Mantar, Sebze",a101,Atlamataşı Fatih Istanbul,52.5,"175,00 ₺/kg",03.07.2025 10:20,0,İSTANBUL
Mantar,Dilim Mantar 400 gr,Markasız,"Mantarlar, Sebzeler, Taze Gıdalar, Sebze, Meyve Ve Sebze, Egzoti̇k Sebzeler İşleti̇ci̇, Sebzeler Işletici, Mantar Işletici",sok,Cemberlıtas,34.9,"87,25 ₺/kg",03.07.2025 10:20,0,İSTANBUL
Mantar,Mantar 400 gr Safkar,Markasız,"Yeşillikler, Meyve Ve Sebzeler, Yeşillikl",hakmar,Valide  Üsküdar,29.95,"74,88 ₺/kg",03.07.2025 10:20,0,İSTANBUL
Mantar,Mantar İstridye 200 gr Paket,Markasız,"Mantarlar, Sebzeler, Taze Gıdalar, Sebze, Meyve Ve Sebze, Egzoti̇k Sebzeler İşleti̇ci̇, Sebzeler Işletici, Mantar Işletici",sok,Cemberlıtas,59.9,"299,50 ₺/kg",03.07.2025 10:20,0,İSTANBUL
