,name,brand,categories,marketName,depotName,price,unitPrice,updateDate,marketDistance,Şehir
Taze Fasulye,Fasulye Çalı,Markasız,"Meyvelerı Yenen Sebz, Mevsi̇m Sebzeleri̇, Normal Se, Meyve Ve Sebzeler, Sebzeler, Taze Gıdalar, Sebze, Meyve Ve Sebze, Normal Sebzeler, Fasulye",sok,Cemberlıtas,79.9,"79,90 ₺/kg",14.07.2025 10:19,0,İSTANBUL
Taze Fasulye,Fasulye Ayşe ,Markasız,"Normal Se, Meyve Ve Sebzeler, Normal Sebzeler",hakmar,Valide  Üsküdar,79.95,"79,95 ₺/kg",14.07.2025 10:19,0,İSTANBUL
Taze Fasulye,Fasulye Taze,Markasız,"Meyvelerı Yenen Sebz, Taze Gıdalar, Sebze, Meyve Ve Sebze",carrefour,Istanbul Cıhangır Gurme,59.9,"59,90 ₺/kg",14.07.2025 10:19,0,İSTANBUL
Taze Fasulye,Fasulye Taze Paket,Markasız,"Mevsi̇m Sebzeleri̇, Sebzeler, Fasulye",sok,Cemberlıtas,89.9,"89,90 ₺/kg",14.07.2025 10:19,0,İSTANBUL
Taze Fasulye,Fasulye Ayşe Kadın,Markasız,"Meyvelerı Yenen Sebz, Mevsi̇m Sebzeleri̇, Sebzeler, Taze Gıdalar, Sebze, Meyve Ve Sebze, Fasulye",sok,Cemberlıtas,79.9,"79,90 ₺/kg",14.07.2025 10:19,0,İSTANBUL
