,name,brand,categories,marketName,depotName,price,unitPrice,updateDate,marketDistance,Şehir
Mantar,Mantar Istiridye ,Markasız,"Meyve Ve Sebzeler, Mantar, Sebze",a101,Saraç Ishak Fatih Istanbul,59.5,"238,00 ₺/kg",19.06.2025 13:12,0,İSTANBUL
Mantar,Mantar Tabak ,Markasız,"Meyve Ve Sebzeler, Mantar, Sebze",a101,Atlamataşı Fatih Istanbul,52.5,"175,00 ₺/kg",19.06.2025 13:12,0,İSTANBUL
Mantar,Mantar Paket 400 Gr,Market Manav,"Meyve Sebze, Mantar, Meyve-sebze, Sebze",tarim_kredi,Istanbul Beyoğlu Piyalepaşa,59.9,"59,90 ₺/kg",19.06.2025 13:11,0,İSTANBUL
Mantar,Dilim Mantar 400 gr,Markasız,"Mantarlar, Sebzeler, Taze Gıdalar, Sebze, Meyve Ve Sebze, Egzoti̇k Sebzeler İşleti̇ci̇, Sebzeler Işletici, Mantar Işletici",sok,Cemberlıtas,49.95,"124,88 ₺/kg",19.06.2025 13:11,0,İSTANBUL
Mantar,Mantar 400 gr Safkar,Markasız,"Yeşillikler, Meyve Ve Sebzeler, Yeşillikl",hakmar,Valide  Üsküdar,59.95,"149,88 ₺/kg",19.06.2025 13:12,0,İSTANBUL
Mantar,Mantar İstridye 200 gr Paket,Markasız,"Mantarlar, Sebzeler, Taze Gıdalar, Sebze, Meyve Ve Sebze, Egzoti̇k Sebzeler İşleti̇ci̇, Sebzeler Işletici, Mantar Işletici",sok,Cemberlıtas,59.9,"299,50 ₺/kg",19.06.2025 13:11,0,İSTANBUL
